<?xml version="1.0" encoding="UTF-8"?>
<!DOCTYPE dictionary SYSTEM "sdef.dtd">
<dictionary>
  <suite name="Standard Suite" code="****" description="Common terms for most applications">
    <class name="application" code="capp" description="The application program">
      <property name="current encoder" code="pEnc" type="encoder" description="the currently selected encoder (MP3, AIFF, WAV, etc.)"/>
      <property name="current EQ preset" code="pEQP" type="EQ preset" description="the currently selected equalizer preset"/>
      <property name="current playlist" code="pPla" type="playlist" access="r" description="the playlist containing the currently targeted track"/>
      <property name="current stream title" code="pStT" type="text" access="r" description="the name of the current song in the playing stream (provided by streaming server)"/>
      <property name="current stream URL" code="pStU" type="text" access="r" description="the URL of the playing stream or streaming web site (provided by streaming server)"/>
      <property name="current track" code="pTrk" type="track" access="r" description="the current targeted track"/>
      <property name="current visual" code="pVis" type="visual" description=" the currently selected visual plug-in"/>
      <property name="EQ enabled" code="pEQ " type="boolean" description="is the equalizer enabled?"/>
      <property name="fixed indexing" code="pFix" type="boolean" description="true if all AppleScript track indices should be independent of the play order of the owning playlist."/>
      <property name="frontmost" code="pisf" type="boolean" description="is iTunes the frontmost application?"/>
      <property name="full screen" code="pFSc" type="boolean" description="are visuals displayed using the entire screen?"/>
      <property name="name" code="pnam" type="text" access="r" description="the name of the application"/>
      <property name="mute" code="pMut" type="boolean" description="has the sound output been muted?"/>
      <property name="player position" code="pPos" type="integer" description="the playerâ€™s position within the currently playing track in seconds."/>
      <property name="player state" code="pPlS" type="ePlS" access="r" description="is iTunes stopped, paused, or playing?"/>
      <property name="selection" code="sele" type="specifier" access="r" description="the selection visible to the user"/>
      <property name="sound volume" code="pVol" type="integer" description="the sound output volume (0 = minimum, 100 = maximum)"/>
      <property name="version" code="vers" type="version" access="r" description="the version of iTunes"/>
      <property name="visuals enabled" code="pVsE" type="boolean" description="are visuals currently being displayed?"/>
      <property name="visual size" code="pVSz" type="eVSz" description="the size of the displayed visual"/>
    </class>
    <enumeration name="eSrA" code="eSrA">
      <enumerator name="albums" code="kSrL" description="albums only"/>
      <enumerator name="all" code="kSrA" description="all text fields"/>
      <enumerator name="artists" code="kSrR" description="artists only"/>
      <enumerator name="composers" code="kSrC" description="composers only"/>
      <enumerator name="displayed" code="kSrV" description="visible text fields"/>
      <enumerator name="songs" code="kSrS" description="song names only"/>
    </enumeration>
  </suite>
</dictionary>